<?xml version="1.0" encoding="UTF-8"?><?xml-stylesheet type="text/xsl" href="Ruleset.xsl"?><ruleset xmlns:xsi="http://www.w3.org/2001/XMLSchema-instance" xsi:noNamespaceSchemaLocation="Ruleset.xsd">  <testinput>    <entry>      <key>test.eq.alpha</key>      <value>abc</value>    </entry>    <entry>      <key>test.eq.num</key>      <value>123</value>    </entry>    <entry>      <key>test.sw</key>      <value>abc</value>    </entry>    <entry>      <key>test.ew</key>      <value>abc</value>    </entry>    <entry>      <key>test.ct</key>      <value>abc</value>    </entry>    <entry>      <key>test.lt.alpha</key>      <value>abc</value>    </entry>    <entry>      <key>test.lt.num</key>      <value>123</value>    </entry>    <entry>      <key>test.gt.alpha</key>      <value>abc</value>    </entry>    <entry>      <key>test.gt.num</key>      <value>123</value>    </entry>    <entry>      <key>test.source</key>      <value>abc</value>    </entry>    <entry>      <key>test.actionsource</key>      <value>xxx</value>    </entry>  </testinput>  <testoutput>    <entry>      <key>test.ct.pass</key>      <value>OK</value>    </entry>    <entry>      <key>test.eq.alpha.fail</key>      <value>OK</value>    </entry>    <entry>      <key>test.gt.alpha.pass</key>      <value>OK</value>    </entry>    <entry>      <key>test.gt.num.pass</key>      <value>OK</value>    </entry>    <entry>      <key>test.gt.num.fail</key>      <value>OK</value>    </entry>    <entry>      <key>test.sw.fail</key>      <value>OK</value>    </entry>    <entry>      <key>test.lt.num.pass</key>      <value>OK</value>    </entry>    <entry>      <key>test.ew.fail</key>      <value>OK</value>    </entry>    <entry>      <key>test.eq.num.fail</key>      <value>OK</value>    </entry>    <entry>      <key>test.actionsource.output</key>      <value>OK</value>    </entry>    <entry>      <key>test.source.static_static</key>      <value>OK</value>    </entry>    <entry>      <key>test.ct.fail</key>      <value>OK</value>    </entry>    <entry>      <key>test.actionsource.input</key>      <value>OK</value>    </entry>    <entry>      <key>actionsource.output</key>      <value>xxx</value>    </entry>    <entry>      <key>test.lt.alpha.fail</key>      <value>OK</value>    </entry>    <entry>      <key>test.source.static_output</key>      <value>OK</value>    </entry>    <entry>      <key>test.sw.pass</key>      <value>OK</value>    </entry>    <entry>      <key>test.lt.num.fail</key>      <value>OK</value>    </entry>    <entry>      <key>actionsource.static</key>      <value>xxx</value>    </entry>    <entry>      <key>test.source.input_static</key>      <value>OK</value>    </entry>    <entry>      <key>test.gt.alpha.fail</key>      <value>OK</value>    </entry>    <entry>      <key>test.source.output_static</key>      <value>OK</value>    </entry>    <entry>      <key>test.eq.num.pass</key>      <value>OK</value>    </entry>    <entry>      <key>actionsource.input</key>      <value>xxx</value>    </entry>    <entry>      <key>test.source.output</key>      <value>xxx</value>    </entry>    <entry>      <key>test.source.static_input</key>      <value>OK</value>    </entry>    <entry>      <key>test.actionsource.static</key>      <value>OK</value>    </entry>    <entry>      <key>test.lt.alpha.pass</key>      <value>OK</value>    </entry>    <entry>      <key>test.ew.pass</key>      <value>OK</value>    </entry>    <entry>      <key>test.eq.alpha.pass</key>      <value>OK</value>    </entry>    <entry>      <key>test.not.condition.pass</key>      <value>OK</value>    </entry>    <entry>      <key>test.not.condition.fail</key>      <value>OK</value>    </entry>    <entry>      <key>test.not.clause.pass</key>      <value>OK</value>    </entry>    <entry>      <key>test.not.clause.fail</key>      <value>OK</value>    </entry>    <entry>      <key>test.clause.and.pass</key>      <value>OK</value>    </entry>    <entry>      <key>test.clause.and.fail</key>      <value>OK</value>    </entry>    <entry>      <key>test.clause.or.pass</key>      <value>OK</value>    </entry>    <entry>      <key>test.clause.or.fail</key>      <value>OK</value>    </entry>    <entry>      <key>test.nested.or_and.pass</key>      <value>OK</value>    </entry>    <entry>      <key>test.nested.or_and.fail</key>      <value>OK</value>    </entry>    <entry>      <key>test.nested.and_or.pass</key>      <value>OK</value>    </entry>    <entry>      <key>test.nested.and_or.fail</key>      <value>OK</value>    </entry>    <entry>      <key>test.nested.rule.outer.pass</key>      <value>OK</value>    </entry>    <entry>      <key>test.nested.rule.inner.pass</key>      <value>OK</value>    </entry>    <entry>      <key>test.nested.rule.outer.fail</key>      <value>OK</value>    </entry>    <entry>      <key>test.nested.rule.inner.fail</key>      <value>OK</value>    </entry>